{
  "paper_id": "mock-eisa-software_developer-paper-02",
  "qualification": "Occupational Certificate: Software Developer",
  "nqf_level": [
    4,
    5
  ],
  "status_disclaimer": "MOCK / PRACTICE ASSESSMENT ONLY. This paper is generated for formative self-assessment and exam-preparation purposes. It is NOT an official QCTO External Integrated Summative Assessment (EISA), is not moderated by MICT SETA, and confers no qualification status or credit.",
  "duration_minutes": 180,
  "total_marks": 100,
  "instructions": [
    "This is a MOCK / PRACTICE assessment for formative preparation. It is NOT an official QCTO External Integrated Summative Assessment (EISA) and carries no official qualification status.",
    "Answer ALL questions in ALL sections.",
    "Read each scenario carefully before answering; several questions integrate more than one competency area.",
    "Write code answers in plain text/pseudocode unless a specific language is requested; assume standard syntax for the language named in the question.",
    "Show your reasoning for calculation and design questions - partial credit is available and requires visible working.",
    "Manage your time: indicative mark values show the expected effort per question.",
    "No electronic devices other than those explicitly permitted by your facilitator may be used."
  ],
  "sections": [
    {
      "id": "A",
      "title": "Programming Fundamentals and Logical Reasoning",
      "marks": 15,
      "outcomes": [
        "KM-04-KT01",
        "KM-04-KT02",
        "KM-04-KT03",
        "KM-04-KT04",
        "KM-04-KT05",
        "KM-04-KT06",
        "KM-04-KT07",
        "KM-04-KT08",
        "KM-04-KT09",
        "KM-04-KT10",
        "KM-04-KT11",
        "KM-05-KT01",
        "KM-05-KT02",
        "KM-05-KT03"
      ],
      "competencies": [
        "Mathematical thinking skills for problem solving",
        "Conversion between decimal and binary systems",
        "Expressing size and magnitude",
        "Error in calculations",
        "Cartesian coordinate system",
        "Pythagorean theorem for finding the distance",
        "Operator precedence",
        "Integer division",
        "Modulus",
        "Increments",
        "Mixing types",
        "Introduction to programming languages",
        "Programming basics",
        "Software applications"
      ],
      "difficulty": "foundational",
      "question_types": [
        "short_answer",
        "code_analysis"
      ],
      "questions": [
        {
          "id": "Q-A1",
          "section_id": "A",
          "question_number": "A1",
          "type": "code_analysis",
          "scenario": "You are a junior developer at Thusong Logistics, a fleet-tracking startup. Before extending the driver dashboard, your lead asks you to work through some numeric and logic checks on paper so the team can confirm your understanding before you touch the codebase.",
          "question": "Answer each part below, showing your working.",
          "marks": 15,
          "difficulty": "foundational",
          "outcomes": [
            "KM-04-KT02",
            "KM-04-KT07",
            "KM-04-KT09",
            "KM-04-KT11",
            "KM-05-KT02"
          ],
          "competencies": [
            "Conversion between decimal and binary systems",
            "Operator precedence",
            "Modulus",
            "Mixing types",
            "Programming basics"
          ],
          "expected_response_type": "worked_calculation",
          "sub_questions": [
            {
              "id": "1",
              "prompt": "A vehicle's onboard unit reports an odometer delta as the binary value 10110. Working from the rightmost digit, determine its decimal equivalent and show the contribution of each bit position.",
              "marks": 3,
              "expected_response_type": "worked_calculation"
            },
            {
              "id": "2",
              "prompt": "A teammate hard-codes a trip-cost estimate as `distance = 23 % 4 * 2 - 5 + 1`. Work out the value `distance` ends up with. For each step, state which single operation you resolved and why it had to happen at that point relative to the others.",
              "marks": 4,
              "expected_response_type": "worked_calculation"
            },
            {
              "id": "3",
              "prompt": "A colleague asks you to review their pull request without running it. Step through the following block one line at a time and record every value it prints, in the order it prints them:\n```\nspeed = 50\nchecks = 0\nwhile checks < 4:\n    if speed > 60:\n        print(\"over limit\")\n    speed = speed + 5\n    checks = checks + 1\n```",
              "marks": 4,
              "expected_response_type": "trace_table_or_output_list"
            },
            {
              "id": "4",
              "prompt": "In Python, a colleague wrote this line to log a trip summary:\n`log = \"Trip length: \" + 12.3 + \" km\"`\nRunning it raises `TypeError: can only concatenate str (not \"float\") to str`. Explain precisely why Python raises this error here, and rewrite the line so it runs successfully and produces the string `\"Trip length: 12.3 km\"`.",
              "marks": 4,
              "expected_response_type": "explanation_and_corrected_code"
            }
          ]
        }
      ]
    },
    {
      "id": "B",
      "title": "Front-End Web Development (HTML5, CSS, JavaScript, OOP)",
      "marks": 30,
      "outcomes": [
        "KM-06-KT01",
        "KM-06-KT02",
        "KM-06-KT03",
        "KM-06-KT04",
        "KM-06-KT05",
        "KM-06-KT06",
        "KM-06-KT07",
        "KM-06-KT08"
      ],
      "competencies": [
        "Core programming",
        "Object-Oriented Programming",
        "General Software Development",
        "Web applications",
        "Applications development",
        "HTML5",
        "CSS",
        "JavaScript"
      ],
      "difficulty": "intermediate",
      "question_types": [
        "code_writing",
        "code_analysis",
        "scenario_extended"
      ],
      "questions": [
        {
          "id": "Q-B1",
          "section_id": "B",
          "question_number": "B1",
          "type": "scenario_extended",
          "scenario": "A small independent bookshop, Paper Trail Books, wants a simple 'Reading Club Sign-Up' feature added to their existing website so visitors can register interest without an account. You have been asked to build the front end for this feature.",
          "question": "Complete the following front-end development tasks for the Reading Club Sign-Up feature.",
          "marks": 30,
          "difficulty": "intermediate",
          "outcomes": [
            "KM-06-KT02",
            "KM-06-KT06",
            "KM-06-KT07",
            "KM-06-KT08"
          ],
          "competencies": [
            "Object-Oriented Programming",
            "HTML5",
            "CSS",
            "JavaScript"
          ],
          "expected_response_type": "html_code_and_short_explanation",
          "sub_questions": [
            {
              "id": "1",
              "prompt": "Write a semantic HTML5 form that captures: full name (required), email address (required, must be a valid email format), and favourite genres as checkboxes for 'Fiction', 'Non-Fiction' and 'Poetry' - the form's requirement is that at least one genre MUST be selected before the form can be submitted. Use appropriate input types and attributes so the browser natively validates the name and email fields without any JavaScript. Then, in 1-2 sentences, state whether HTML5's `required` attribute can, by itself, enforce this at-least-one-checkbox requirement, and explain what you would need to add to actually enforce it.",
              "marks": 6,
              "expected_response_type": "html_code_and_short_explanation"
            },
            {
              "id": "2",
              "prompt": "Using CSS Flexbox, style the form so that on small screens each label appears above its input (stacked, single column), and on screens 768px and wider the labels appear beside their inputs in a single row per field. Include the media query and explain in one sentence why Flexbox is a suitable choice here.",
              "marks": 6,
              "expected_response_type": "css_code_and_short_explanation"
            },
            {
              "id": "3",
              "prompt": "Write JavaScript that intercepts the form's submit event, prevents the default page reload, checks that the name field is not empty and the email field contains an '@' and at least one '.' after it, and - if invalid - displays an inline error message next to the field without using `alert()`. If valid, log the form data to the console.",
              "marks": 8,
              "expected_response_type": "javascript_code"
            },
            {
              "id": "4",
              "prompt": "You are given this object literal used to track a reading-club member:\n```javascript\nlet member = { name: \"Sipho\", booksRead: 2 };\n```\nRefactor this into an ES6 class named `Member` with a constructor, a private or underscore-convention field for `booksRead`, a getter for `booksRead`, and a setter that rejects negative values. Name the specific OOP principle your getter/setter design demonstrates and explain, in 1-2 sentences, why it matters here.",
              "marks": 10,
              "expected_response_type": "javascript_code_and_short_explanation"
            }
          ]
        }
      ]
    },
    {
      "id": "C",
      "title": "Systems Modelling with UML",
      "marks": 15,
      "outcomes": [
        "KM-07-KT01",
        "KM-07-KT02",
        "KM-07-KT03",
        "KM-07-KT04",
        "KM-07-KT05",
        "KM-07-KT06",
        "KM-07-KT07",
        "KM-07-KT08",
        "KM-07-KT09",
        "KM-07-KT10",
        "KM-07-KT11",
        "KM-07-KT12",
        "KM-07-KT13",
        "KM-07-KT14",
        "KM-07-KT15"